title,Topic,article,keywords
Religious trips will fuel India’s tourism boom — airlines are gearing up with record aircraft orders,economy,"India's tourism sector is set for a boom as more travelers take trips around the country for religious purposes.

The South Asian country with the world's largest Hindu population could see an additional 50 million to 100 million tourists a year on account of the new Ram Mandir — a temple in the northern city of Ayodhya inaugurated on Monday — according to Jefferies.

This expected footfall in the new temple will be much higher than the annual numbers for the Taj Mahal (6.5 million) in India, Rome's Vatican City (9 million) and the Mecca in Saudi Arabia (20 million), the note showed.

Other religious sights in India such as the Tirupati Temple in Andhra Pradesh — 25 million visitors annually — and the Vaishno Devi Temple in Jammu and Kashmir — 8 million visitors per year — also hold a strong spiritual, historical and cultural significance in India, the investment bank said.

""Religious tourism is still the biggest segment of tourism in India … the creation of a new religious tourist centre (Ayodhya) with improved connectivity and infrastructure can create a meaningfully large economic impact,"" Jefferies highlighted.

Indian media reported that around half a million people visited the Ram temple on its opening day which was inaugurated by Prime Minister Narendra Modi. The YouTube broadcast of the opening ceremony on Modi's channel alone received more than 11 million views.

""The multiplier effect of travel is humongous. If it continues develop tourist destination including religious tourism, chances are that more and more people will come to visit India and it will even benefit on the foreign exchange side,"" said Nilesh Shah, managing director at Kotak Mahindra Asset Management.","['tourist', 'ram', 'opening', 'orders', 'boom', 'india', 'record', 'million', 'temple', 'gearing', 'visitors', 'trips', 'tourism', 'religious', 'inaugurated', 'indias', 'fuel', 'airlines']"
Elon Musk’s AI start-up seeks to raise $6bn from investors to challenge OpenAI,others,"Then $29 per 3 months. Today's FT for easy reading on any device, with a brand new app. Please note this does not include access to ft.com or the FT main app.","['seeks', 'main', 'months', 'startup', 'reading', 'note', 'musks', 'openai', 'todays', 'easy', 'ai', 'challenge', 'app', 'raise', 'include', 'investors', 'ft', 'ftcom', '6bn', 'elon']"
Why is it so hard to junk junk fees?,others,"Try unlimited access Only $1 for 4 weeks

Then $75 per month.

Complete digital access to quality FT journalism on any device. Cancel anytime during your trial.","['unlimited', 'weeksthen', 'hard', 'fees', 'access', 'journalism', 'monthcomplete', 'try', 'ft', 'junk', 'digital', 'trial', 'quality']"
Lessons from a lifetime in investment,economy,"Print this page

Looking back over my five and a half decades exploring investment and finance, I have to ask the inevitable question: what have I learned from it all?

The period has been marked by a welter of financial innovation, regulatory change, booms and busts, banking crises, geopolitical tension and much else besides. From this protracted drama it is hard to extract a set of simple coherent lessons for investors. Yet I believe that there are some eternal verities in investment and finance. They are often counterintuitive and not always aligned with conventional economic wisdom.

My early education in investment started in the great bull market of the late 1960s, in which a heady pace was set by the so-called Nifty Fifty growth stocks on the New York Stock Exchange. In the brief period I spent in the City of London, becoming a chartered accountant, I had the good fortune to be sent on the audit of the Imperial Tobacco pension fund. This was run by one of the great investment gurus of the postwar period, the actuary George Ross Goobey.

When Ross Goobey went to the Imperial fund in 1947, pension funds were mainly invested in gilt-edged securities, which were regarded as safer than equities. In his view this was a nonsense.

Against the consensus

His thinking, he told me, was not based on sophisticated economics or actuarial legerdemain. He merely thought that the Labour chancellor Hugh Dalton’s 2.5 per cent fixed interest gilts were a swindle when inflation was running at more than 4 per cent. They could not, he thought, deliver the requisite returns to meet Imperial’s pension obligations.

Equities, by contrast, looked to him absurdly cheap. Ross Goobey managed the remarkable feat of persuading the fund’s trustees to let him invest in equities and dump the fund’s gilts.

In the bull market conditions of the late 1960s the Imperial fund’s portfolio struck me as bafflingly cumbersome. It contained nearly 900 holdings in mainly small and medium-sized — far from nifty — quoted UK companies. The fund was stuck with them regardless of their performance because Ross Goobey insisted his managers should never trade, only buy and hold.

Particularly unfathomable to me was his injunction to his managers to buy nothing that yielded less than 6 per cent. In a raging bull market this ensured exposure to some of the shakiest companies on the London Stock Exchange.

A few went bust in the subsequent recession. Yet, thanks to the policy of extreme diversification, the portfolio damage was marginal. In addition the high-yield injunction protected the fund from exposure to the most overvalued (and thus low-yielding) companies in the boom.

Here was an object lesson in the workings of diversification, though not quite as envisaged by economists such as Harry Markowitz, for whom the “free lunch” of diversification came primarily from spreading bets across different asset classes. Ross Goobey instead took a very risky bet on a single asset class while diversifying within it. The risk of capital loss was mitigated by the yield discipline he imposed.

So great were the returns that Imperial enjoyed pension contribution holidays for years. Other institutional investors followed suit by dropping gilts in favour of ordinary shares. Ross Goobey was credited with founding what came to be known as “the cult of the equity”.

Among the enduring lessons: diversification is an invaluable risk management tool. High yield, though often an indicator of dividend cuts to come, can be a good defence in an overheated market; equating risk with volatility, as so many economists do, may be less helpful, especially for private investors, than focusing on avoiding loss of capital. Meanwhile, reducing transaction costs by minimising share trading bolsters investment performance. That logic has turbocharged the rise of passive investing.

A decade of financial turbulence

The 1970s provided me with an induction course, first on the Investors Chronicle and The Times, then as financial editor of The Economist, in the dynamics of booms and busts. The unintended consequences of deregulation — a recurring theme in financial markets — helped shape what proved in economic and financial terms to be an exceptionally violent decade.

Exhibit A in the saga was US President Nixon’s cancellation in 1971 of the convertibility of the dollar into gold. The resulting deregulation of exchange rates unleashed volatile cross-border capital flows that caused wild swings in global asset prices. Exhibit B was the shift in the banking system from being a home for low-risk, highly regulated quasi-utilities — a product of the troubled 1930s — to an adventure playground in which bankers’ insatiable risk appetite was substantially liberated.

A radical and still instructive deregulatory experiment took place in the UK in 1971. The Bank of England scrapped quantitative ceilings on bank lending in favour of indirect controls, such as balance sheet ratios. This unleashed a wild acceleration of the money supply and credit. Excess liquidity poured into an overheating property market. Then came the 1973 oil crisis, soaring inflation, recession and financial crisis. Property, gilts and equities all plunged.

In equities, the dramatic share price collapse was driven by financial institutions’ selling. Their fear was not ill-founded. In confronting inflation, the Conservative government of prime minister Edward Heath removed key props of the capitalist system by adopting price, dividend and commercial rent controls.

At the same time companies faced not only spiralling wage bills but penal tax liabilities. This was because corporation tax was charged on paper profits from stock appreciation, the difference between the original cost of inventory and the inflated cost of replacing it. Result: British industry was going bust.

When Labour replaced the Tories in early 1974 chancellor Denis Healey intensified the corporate fiscal clamp. Yet by the autumn he had grasped that the corporate sector was being terminally throttled. He introduced tax relief for stock appreciation along with other breaks.

Timing the market

Policy U-turns often signal market turnarounds. Healey’s move to put British capitalism back on its feet should have ended the bear market. Yet in the fourth quarter of 1974, fearful insurance companies, pension funds, investment trusts and unit trusts together sold more shares than they bought for the first and last time during the decade.

Then on January 6 1975, after a peak-to-trough fall on the FTSE All-Share index of 72.9 per cent, the market inexplicably turned and rose vertically. It was impossible for the institutions to get back into the market without causing prices to move spectacularly against themselves.

That is a reminder of the futility, for most investors, of trying to time the market and of the difficulty of contrarianism, the art of investing against the consensus. Note, though, that Ross Goobey, hitherto an equity ideologue, once again defied convention.

When undated gilt yields reached 17 per cent in the mid-1970s the Imperial fund took a big bet on these government IOUs. Ross Goobey’s thinking was that if inflation came down this was an unbelievable bargain. But if the economy was going to hell in a handcart all bets were off anyway.

Of course, all bets are never off in financial markets, not least because when that becomes the common perception, gold comes into its own. There lies the case for the yellow metal as a hedge against catastrophe.

Why should this episode resonate with us today? While economists have explained exhaustively that we are not now reliving the 1970s the similarities remain more striking than the differences. Both periods saw supply side energy and commodity shocks, together with surging money supply. Governments turned on the fiscal tap in response.

Central bankers in both periods initially declared they could do nothing to curb an inflation induced by supply shortages. They were slow to see the demand side of the equation and the risk of second round effects in labour markets. And 21st century central banks’ economic models provided useless forecasts when confronted with supply shocks. So they fell back on a shaky, data-dependent (in other words, backward-looking) monetary policy.

One lesson is that investors, as well as central bankers, ignore money supply signals at their peril. Another is that in such inflationary periods government bonds cease to provide a diversifying hedge against supposedly riskier assets.

Dotcom delirium

Fast forward, now, to the second half of the 1990s, by which time I had been writing for the FT for a decade and a half. The dotcom boom was turning into a bubble, once again making a nonsense of mainstream economists’ belief that markets are “efficient” or reflect fair market values.

An important psychological factor in the tech euphoria was “Fomo” (fear of missing out) which goes back in history at least as far as the South Sea Bubble of the early 18th century. Fomo adds to investors’ myopia over the risk of capital loss.

For professional investors fear of missing out is more a matter of business and career risk. They are usually benchmarked against an index or peer group. So if they stand against a bubble and underperform the index, clients defect and they may be fired.

This was the fate of Tony Dye, the former chief investment officer of Phillips & Drew Fund Management, during the tech bubble. By shunning overvalued tech and going heavily into cash he seriously underperformed PDFM’s peer group, leading to his ousting just two weeks before the bubble burst. Small wonder fund managers tend to hug their benchmarks.

A typical trading room, the modern face of the City. © Simon Dawson/Reuters

Central banks responded to the dotcom bust with rapid interest rate cuts. This cemented a view in the markets that policy was asymmetric. That is, the central banks would never lean against a bubble and would reliably extend a safety net when it burst.

The moral hazard implicit in asymmetric policy helped pave the way for the wild credit bubble of the 2000s (see below). Then came the great financial crisis of 2007-09. The central banks’ response was once again to come to the rescue and keep interest rates ultra low for a decade while buying up government bonds and other assets via so-called “quantitative easing”. A further round of propping up followed the pandemic and the war in Ukraine.

By the post-crash 2010s the UK investment scene had reverted to something like the pattern that confronted George Ross Goobey after the second world war. Pension funds had run down their equity holdings to near-zero. Quirky accounting standards and pressure from The Pensions Regulator had pushed them into liability-driven investment. Instead of seeking to maximise the return on their assets, trustees sought to match their liabilities by buying what economists and actuaries described as “safe” government bonds.

Yet nothing in investment is ever safe — witness how the collapse in US Treasuries contributed to the failure of Silicon Valley Bank and other US regional banks last year. And the regulators’ attempts to make individual pension funds risk-free makes the overall market structure more risky: if everyone pursues the same strategy, when the market moves, it moves all one way. That eternal verity re-emerged in the pension fund crisis in the gilt market in 2022.

After a lifetime spent watching the markets, I am struck how, with each new cycle in which central banks act as lenders of last resort, debt mounts inexorably. We continue to muddle through. But a great debt denouement is inevitable because debt cannot rise faster than incomes for ever.

Since debt implosions are inherently deflationary — see Japan in the 1990s — gold, ever resilient against inflation, may not provide insurance against falling prices but government bonds certainly will. To conclude; it is tempting to quote the US economist Herbert Stein who remarked that if something can’t go on forever, then it will stop. But as I have remarked here before, the wise rejoinder by fellow economist Rudi Dornbusch was: yes, but it will go on for a lot longer than you anticipate.","['goobey', 'lifetime', 'lessons', 'fund', 'investment', 'financial', 'investors', 'risk', 'market', 'funds', 'pension', 'ross']"
Intel seen struggling to ‘find its footing’ as guidance miss sends stock tanking,economy,"Intel Corp.’s stock hasn’t seen a double-digit percentage decline in more than two years. But it might break that streak after a downbeat earnings forecast.

The company late Thursday issued an outlook for first-quarter adjusted earnings per share of 13 cents on revenue of $12.2 billion to $13.2 billion. Both forecasts came up well shy of the FactSet consensus: Analysts had been modeling 34 cents in adjusted EPS along with revenue of $14.3 billion.

“While we expect a slightly sub-seasonal first quarter from our core product businesses, we see material inventory corrections in Mobileye and PSG,” Intel INTC, +0.94% Chief Financial Officer David Zinsner said on the earnings call, referring to the Programmable Solutions Group.

Furthermore, the company anticipates “a significant drop in [Intel Foundry Services] revenue after seeing accelerated purchasing in our traditional packaging business and cyclical weakness in wafer equipment-buying in the first half of the year,” he continued.

Intel’s stock fell 10.9% in after-hours action Thursday. If such a decline carried through to Friday’s close, it would mark the stock’s worst single-day percentage decline since Oct. 22, 2021, when it fell 11.7%, according to Dow Jones Market Data. After that, the worst drop was an 8.6% plunge seen July 29, 2022.

“We think Intel shares are justifiably selling off following soft [first-quarter] guidance that leaves us to question when the company will find its footing as competitors capitalize on an ongoing AI server [capital-expenditure] cycle,” Wells Fargo analyst Aaron Rakers wrote in a note to clients.

Also read: Opinion: Intel’s stock plunge shows that Wall Street still hasn’t learned its lesson on AI hype

The guidance miss comes as Intel’s stock has enjoyed a nice recent rally, surging about 50% since the company last posted results three months ago. The recent run in the share price “raised the bar on expectations,” an HSBC analyst wrote earlier this week.

Intel’s whiff on the outlook overshadowed better-than-expected results for the latest quarter, in which the company generated net income of $2.7 billion, or 63 cents a share, versus a loss of about $700 million, or 16 cents a share, in the year-prior period. On an adjusted basis, Intel earned 54 cents a share, while analysts were modeling 45 cents a share.

“We expect to unlock further efficiencies in 2024 and beyond as we implement our new internal foundry model, which is designed to drive greater transparency and accountability and higher returns on our owners’ capital,” Zinsner said in a release.

Revenue climbed to $15.4 billion from $14.0 billion, whereas the FactSet consensus called for $15.2 billion.

Read: Missed the boat on AMD’s stock surge? Why this analyst says you’re not too late.

Intel saw a 33% boost in revenue, to $8.8 billion, from its client-computing group, which is the company’s largest unit and the one that encompasses PCs. Analysts had been modeling $8.5 billion.

Revenue from the data-center and artificial-intelligence group was down 10% to $4.0 billion, while analysts were looking for $4.1 billion.

The company’s network and edge business saw a 24% drop in revenue, to $1.5 billion, relative to a year before. That total matched the FactSet consensus.

Meanwhile, Mobileye revenue increased 13% to $637 million, and foundry services revenue jumped 63% to $291 million.

Don’t miss: Nvidia is no longer Morgan Stanley’s top chip pick. A much different name is.

Check out On Watch by MarketWatch, a weekly podcast about the financial news we’re all watching — and how that’s affecting the economy and your wallet. MarketWatch’s Jeremy Owens trains his eye on what’s driving markets and offers insights that will help you make more informed money decisions. Subscribe on Spotify and Apple.","['miss', 'foundry', 'footing', 'intel', 'company', 'sends', 'tanking', 'analysts', 'modeling', 'guidance', 'struggling', 'stock', 'revenue', 'cents', 'seen', 'share', 'billion']"
Utz voluntarily recalls 88 cases of milk-contaminated potato chips,economy,"Utz Brands’ UTZ, +3.15% subsidiary issued a voluntary recall of 88 cases of potato chips on Thursday due to an undeclared milk contamination.

Utz Quality Foods, based in Hanover, Pa., said it learned that about 1,200 single-serve bags with Utz Wavy Original Potato Chips were flavored with seasoning instead of the plain version of the chip.

The company said those with allergies or sensitivities to milk may have a reaction if they consume the product.

The items in the recall were distributed only in New York state, primarily in New York City.","['recall', 'wavy', 'utz', 'milk', '88', 'voluntarily', 'potato', 'milkcontaminated', 'cases', 'recalls', 'york', 'voluntary', 'version', 'undeclared', 'chips']"
"Visa posts earnings beat, but here’s why Wall Street says the stock is falling",economy,"Visa Inc. called out resilient spending as it logged an earnings beat for the latest quarter, but its shares were still coming under pressure in Thursday’s after-market action.

The culprit? A slowdown in U.S. volumes into January, according to analysts.

Mizuho analyst Dan Dolev noted that Visa’s V, +0.35% U.S. payment volumes decelerated in the fiscal first quarter and in the first three weeks of January, a trend driven by debit transactions.

Visa

Baird analyst David Kallo said that while the deceleration in January U.S. volumes and total processed transactions was “not a huge surprise,” those trends could cause the stock to “pull back mildly tomorrow.”

Visa Chief Financial Officer Chris Suh said the January U.S. trends reflected one-off factors that weren’t indicative of broader spending issues. For example, areas like Kansas City and Dallas have seen extreme cold temperatures that have prevented people from going out and spending.

“We’ve seen weather-related patterns before,” he said. “It doesn’t give us major concern.”

As for the December-quarter volume trends, he said the slowdown was a matter of timing.

“Putting it all together, the step-down of about 80 basis points in total U.S. payments volume growth from Q4 to Q1 was primarily due to a less favorable mix of weekends and weekdays,” he said on Visa’s earnings call.

“Consumer spend across all segments from low to high spend has remained relatively stable,” he continued. “Our data does not indicate any meaningful behavior change across consumer segments.”

Investors, though, still seemed concerned, and shares fell nearly 3% in after-hours trading Thursday.

See also: PayPal CEO sees ‘huge monetization opportunity’ after revamp, but stock drops

For the fiscal first quarter, Visa posted net income of $4.9 billion, or $2.39 a share, compared with net income of $4.2 billion, or $1.99 a share, in the year-prior period. After adjustments, Visa earned $2.41 a share, beating the FactSet consensus view, which was for $2.34 a share.

Revenue rose to $8.63 billion from $7.94 billion, whereas analysts had been looking for $8.56 billion.

The company saw an 8% boost in payments volume during the latest quarter, while processed transactions rose by 9%.

Consumer spending has been “resilient” and “quite stable,” Suh said.

The company saw a 16% boost in volume from cross-border transactions, which take place when someone makes a purchase from a merchant based in a different country. Cross-border volume typically is seen as a proxy for international travel, though it also encompasses international e-commerce purchases.

“Travel contunues to be a tailwind” and is “quite healthy,” Suh told MarketWatch.

For the fiscal second quarter, Visa expects net revenue to grow at an “upper-mid” to high-single-digit rate. The company also expects earnings per share to grow at a “high-teens” pace from a year before.

The company is sticking with its full-year forecast, which calls for low-double-digit revenue growth on an adjusted constant-dollar basis.

Fiscal 2024 could be “a little bit of a mirror image of 2023 in the sense that our first-half revenue growth rate, even if the fundamentals are very stable…will be compressed just because of the high comparables a year ago, and we see lots of reasons why the second-half-of-the-year growth rates will accelerate,” Suh told MarketWatch.

The company faces easier comparisons in the second half of the year, he said, and management expects to see favorable trends in average ticket sizes.

Check out On Watch by MarketWatch, a weekly podcast about the financial news we’re all watching — and how that’s affecting the economy and your wallet. MarketWatch’s Jeremy Owens trains his eye on what’s driving markets and offers insights that will help you make more informed money decisions. Subscribe on Spotify and Apple.","['falling', 'beat', 'volume', 'quarter', 'heres', 'earnings', 'company', 'suh', 'share', 'growth', 'volumes', 'wall', 'posts', 'stock', 'billion', 'street', 'visa', 'trends']"
