title,Topic,article,keywords
"4,700 U.S. auto dealers urge President Biden to ‘hit the brakes’ on EPA push on stricter vehicle-pollution standards",environment,"More than 4,700 auto dealerships across the United States urged President Joe Biden in a letter Thursday to halt the Environmental Protection Agency’s efforts to enforce stricter vehicle-pollution standards.

The missive comes just weeks before the agency’s expected ruling on its tailpipe-emissions proposal, which addresses both climate change and pollutants that are harmful to health.

It is the second letter that auto dealers have sent to the White House in two months on the EPA’s upcoming ruling, which could codify the agency’s strictest-ever tailpipe emissions limits, proposed last April. The dealerships said Thursday that the Biden administration did not respond to their first letter sent on Nov. 28.

An EPA spokesperson said the agency cannot comment as the proposal is currently in the interagency review process.

“President Biden is investing in a future that is made in America by American workers as we position the United States to lead the clean energy future,” a White House spokesperson said in a statement Thursday. “More Americans are buying EVs every day—with EV sales rising faster than traditional gas-powered cars—as the President’s Inflation Reduction Act makes EVs more affordable and helps Americans save money when driving.”

With the world focused on trying to limit warming to no more than 1.5-degree Celsius temperature above pre-industrial times, the administration has an ambitious goal to cut domestic planet-warming greenhouse gas emissions in half by 2030. Part of its focus is on the transportation sector, 58% of the emissions from which come from passenger cars and trucks, according to the EPA. The regulation also limits hydrocarbons, nitrogen oxides, and particulate matter into the air. These emissions cause a host of health issues and disproportionately affect people who live near heavy traffic.

The EPA says its proposed regulations could mean that up to two out of every three vehicles sold in the U.S. are electric by 2032. That’s higher than the administration’s target of 50% set two years ago.

The regulations, which impact light- and medium-duty vehicles beginning with the 2027 model year, could mean a 56% drop in projected greenhouse gas emissions from the fleet, relative to existing standards, avoiding nearly 7.3 billion metric tons of carbon dioxide emissions by 2055. They also reduce pollutants harmful to health by 60% from the existing standard by model year 2032.

Most automakers around the globe have pledged hundreds of billions of dollars to transition to all-electric new vehicle sales in the coming decade as momentum to address climate change builds. Last year, U.S. EV sales overall grew 47% to a record 1.2 million, according to Motorintelligence.com. EVs are seeing year-over-year growth, but only hit 7.6% of overall market share in 2023.

Given that, thousands of auto dealers say they won’t be able to meet the EPA’s stringent goals.

Nearly 4,000 dealerships of the nearly 17,000 franchised shops nationwide asked Biden to “tap the brakes” on the EPA proposal in the November letter, referring to the rules as an “electric vehicle mandate.” House Republicans approved a bill in December to block the pollution limits and also called the rules a mandate.

In this week’s letter, the dealerships asked Biden to “hit the brakes” entirely, citing several factors that they say indicate slowing EV adoption. The signers said the supply of EVs on dealer lots is twice that of internal combustion engine vehicles, and that they won’t be able to sell EVs at the rate the regulations would require.

“It is uncontestable that the combination of fewer tax incentives, a woefully inadequate charging infrastructure, and insufficient consumer demand makes the proposed electric vehicle mandate completely unrealistic,” the letter says.

The EPA’s tailpipe-pollution limits wouldn’t require automakers to sell a specific number of EVs every year.

Automakers can meet EPA regulations not just through pure-electric vehicle sales, but also through a sales mix including hybrid and plug-in hybrid electric vehicles, plus cleaner internal-combustion engine vehicles. The EPA has also said that the auto industry could employ widespread use of particulate filters, which mitigate the soot emitted from conventional gasoline-fueled engines.

“In order to stay on track to meeting overall climate policy goals that have been adopted by the country, I think it’s important to be aggressive in this sector where you have the technology, progress is being made, there’s momentum in markets,” said Jessika Trancik, a professor in energy studies at the Massachusetts Institute of Technology. “This can be a really important part of the overall effort to reach 2030 and ultimately, 2050 emissions reduction targets.

“There are a number of different ways you can improve efficiencies and reduce emissions,” Trancik added. But, “If you want to meet those targets, fully electric vehicles are probably going to be a really important tool, at least in part, to allow for that because they do offer the greatest emissions cuts.”

The EPA is also proposing regulations for medium- and heavy-duty trucks, and the government’s National Highway Traffic Safety Administration has separately proposed a fuel-economy increase.","['biden', 'brakes', 'emissions', 'evs', 'vehicle', 'sales', 'hit', 'push', 'stricter', 'regulations', 'president', 'epa', 'letter', 'vehicles', 'vehiclepollution', 'dealers', 'standards', 'urge', 'electric']"
OpenAI CEO Sam Altman is meeting the world’s top two producers of memory chips as he reportedly fundraises for his own semiconductor plants,others,"OpenAI Chief Executive Officer Sam Altman is visiting leaders of South Korea’s semiconductor industry this week, as the artificial-intelligence pioneer weighs an ambitious move into chip production.

Altman, who arrived in Seoul Thursday evening, is touring Samsung Electronics Co.’s chip fabrication plants in Pyeongtaek on Friday, according to a person familiar with the matter. He’ll meet the top executive of Samsung’s semiconductor business, as well as divisional heads of the foundry, memory and system LSI units, said the person, who asked not to be named as the matter is private. He is also scheduled to meet the CEO of rival SK Hynix Inc. and SK Group Chairman Chey Tae-won to discuss ways to collaborate, the person said.

Since OpenAI released ChatGPT more than a year ago, interest in AI applications has skyrocketed, spurring massive demand for the computing power and processors needed to build and run those AI programs. Altman has repeatedly said there already aren’t enough chips for his company’s needs.

It’s not clear what the goals of Altman’s Korea trip are. He has been working to raise billions of dollars to set up a network of factories to manufacture semiconductors, Bloomberg News reported this month. Samsung has been expanding its foundry business, which manufactures chips to the designs of its customers.

Representatives for Samsung and SK Hynix declined to comment. OpenAI representatives didn’t immediately respond to requests for comment.

South Korea is a leader in high-end chip production, dominating the market with Taiwan. Taiwan Semiconductor Manufacturing Co. is the leading foundry in the world, crafting chips for the likes of Apple Inc. and Nvidia Corp.

The Korean government this month outlined a blueprint involving investment of 622 trillion won ($466 billion) from the private sector in the years leading up to 2047. They will spend the money to build 13 new chip plants and three research facilities, on top of an existing 21 fabs. Spanning Pyeongtaek to Yongin, the area is expected to be the largest in the world, capable of producing 7.7 million wafers monthly by 2030.

The world’s two biggest memory chipmakers are trying to build their most sophisticated chip plants at home. Samsung is betting big on the foundry expansion as part of a 500 trillion won investment by 2047. SK Hynix aims to invest 122 trillion won in memory in Yongin over the same period.","['plants', 'openai', 'reportedly', 'semiconductor', 'samsung', 'person', 'sam', 'meeting', 'sk', 'won', 'producers', 'memory', 'fundraises', 'worlds', 'foundry', 'trillion', 'chip']"
German coffee firm shuts Kenya operations on sector reforms chaos,environment,"Companies German coffee firm shuts Kenya operations on sector reforms chaos

A farmer tends to her coffee. President William Ruto signed an executive order tasking DP Rigathi Gachagua with spearheading reforms in the coffee and tea sub-sectors. FILE PHOTO | JOSEPH KANYI | NMG

By PETER MBURU

More by this Author

A global coffee miller has announced plans to shut its operations in Kenya next month as the bungled government-backed reforms in the coffee sector continue to disrupt the industry.

NKG Coffee Mills Kenya, a member of Germany’s Neumann Kaffee Gruppe, says it will lay off staff by the end of February, citing recent regulatory changes in the industry, after the implementation of the Coffee Regulations, 2019 and Capital Markets (Coffee Exchange) Regulations, 2020.

“Following these changes, NKG Coffee Mills Kenya Ltd has not been able to secure the milling license and it is in this regard that the company has taken the decision to close the milling operations. In these ongoing changes, there is a potential/possibility of certain posts within the company’s staff establishment becoming redundant,” the company said.

The letter by the company’s regional head of Human Resources (HR) Hellen Akumu followed a meeting on January 16 by the business to assess its operations and said that there would be consultations to explore alternatives before the February 29 deadline.

The company, which operates across different countries, said it was finalising the plans this month and next.

“The business will set up consultative meetings within the months of January and February 2024. The ideas offered will be given due consideration as we finalise the plans. We shall after this period communicate the final position on the intended redundancy,” Ms Akumu said.

Read: DP Gachagua-led taskforce wrests coffee sector from cartels

“Whilst exploring alternative avenues during consultations, we wish to notify you of the intended redundancy. If no alternative is found and the redundancy confirmed, as per existing laws, [it] will be effective from February 29, 2024,” the letter stated.

The Hamburg-headquartered NKG has more than 60 companies across the globe.

Kenya coffee is marketed either through the weekly Nairobi Coffee Exchange or sold directly to buyers abroad.

It is not clear the number of workers who will be affected by the looming layoff since the company has not made public details of its employees in Kenya.

Available details, however, show that the company, which has operations in 27 countries, employs 495 people in Africa. Across the 27 countries where it operates, the company employs more than 3,200 people.

In Kenya, the company operates through two subsidiaries, Ibero Kenya Limited, which deals in export and milling, and Tropical Farm Management Kenya, a marketing agent, financer and service provider to farmers.

The exit of the miller and exporter is also set to hit farmers and other workers not directly under its employ but have benefited from its operations across value chains.

President William Ruto in January 2023 signed an executive order tasking his deputy Rigathi Gachagua with spearheading reforms in the coffee and tea sub-sectors.

The campaign has proposed restructurings that include the introduction of a direct settlement system (DSS) aimed at realising expedited and transparent payment of coffee sales proceeds.

The drive is also seeking to push the enactment of the Coffee Bill 2023 that proposes to reorganise the industry by transitioning the regulatory and commercial roles currently undertaken by the Agriculture and Food Authority to the Coffee Board of Kenya.

Further, the legislative proposal also aims at transitioning coffee research currently undertaken by the Coffee Research Institute under the Kenya Agricultural and Livestock Research Organisation to the Coffee Research Institute.

These scheduled reforms have, however, triggered chaos in the sector amid delays in the issuance of marketing and milling permits. This has left millers and marketers without stocks for processing and sale.

Read: Coffee sector players upbeat Gachagua steering reforms

Kenya’s coffee is much sought after by roasters and blenders and the international prices are used as a benchmark for the local price at the Nairobi exchange. The sector is, however, limping and requires a revamp as more farmers abandoned the crop for better rewarding ventures such as real estate and avocado farming.

The State is working to curb the slump amid concerns that the once thriving coffee sub-sector has lost its shine, with production declining from 130,000 tonnes to an average 40,000.

→ [email protected]","['sector', 'coffee', 'chaos', 'shuts', 'operations', 'redundancy', 'company', 'firm', 'milling', 'research', 'kenya', 'reforms', 'german', 'plans']"
"IMF in new tax onslaught on rich Kenyans, large investors",economy,"Economy IMF in new tax onslaught on rich Kenyans, large investors

Multiple tax incentives and exemptions handed out to the ultra-wealthy and large investors in the past decade are undermining Kenya’s ambition to grow revenues. CONCEPT | SHUTTERSTOCK

By KEPHA MUIRURI

More by this Author

Multiple tax incentives and exemptions handed out to the ultra-wealthy and large investors in the past decade are undermining Kenya’s ambition to grow revenues, the International Monetary Fund (IMF) has said.

The IMF, in a new analysis of tax policy and administrative changes in the East African Community countries, says that Kenya’s tax-to-GDP ratio has been on a downward trajectory since peaking in 2014 after the country implemented policies that have ended up narrowing the tax base.

Read more HERE","['ultrawealthy', 'tax', 'rich', 'onslaught', 'large', 'investors', 'kenyans', 'imf', 'kenyas', 'incentives', 'past', 'undermining', 'revenues']"
Documentary gives peep into 1985 recording of iconic 'We are the World' song,others,"Performing Arts Documentary gives peep into 1985 recording of iconic 'We are the World' song

Lionel Richie co-producer of The Greatest Night In Pop during the premiere of the documentary at the Sundance Film Festival in Utah, US on January 19, 2024. PHOTO | POOL

By BILL ODIDI

More by this Author

“We are the world. We are the children. We are the ones who make a brighter day so let’s start giving”

On January 28, 1985, some of the biggest names in American music gathered at A&M Studios in Hollywood, Los Angeles to record a song to support famine relief in Ethiopia. We Are The World became a global anthem using the power of music to turn the world’s attention to the hunger crisis in the Horn of Africa.

The story surrounding that historic recording is revealed in The Greatest Night In Pop, a documentary that premiered at the 2024 Sundance Film Festival on January 19 and is available to stream on Netflix from January 29 2024. That date is significant because it marks exactly 39 years to the week the crème de la crème of American music gathered for a marathon recording session. As the 46 stars arrived at the studio straight from attending that night’s American Music Awards, they were greeted with a sign pinned by the record’s producer and conductor Quincy Jones, “please, check your ego at the door”.

Featuring never-before-seen footage, the film reveals the early planning stages of the recording done under United Support of Artists for Africa (USA for Africa), including the writing sessions of Michael Jackson and Lionel Richie. Some of the artists who were at that historic session including Richie, Bruce Springsteen, Smokey Robinson, Cyndi Lauper, Kenny Loggins, Dionne Warwick and Huey Lewis, along with musicians, engineers and production crew reminisce about the events of that night.

Producer Julia Nottingham and director Bao Nguyen who worked together on the 2020 documentary Be Water about legendary martial artist Bruce Lee, reunite for this project that was conceptualised during the pandemic. “My parents were refugees from Vietnam and were music fans, though, and one of the lasting memories I had of childhood was listening to Kenny Rogers and Lionel Richie records,” recalls Bao who was no more than 4 years old when We are the World was released. “Those echoes of childhood came back when Julia mentioned the project to me.

Also read: 'King of Calypso' who used music to end injustices

Among the director’s first tasks was watching the 1985 documentary We Are the World: The Story Behind the Song hosted by actress Jane Fonda and from that he drew parallels with a heist storyline. “You have all these participants who each have their own superpower, they have this impossible task of assembling this iconic team and recording this song, and they have one night to do it.”

The new film takes a different approach to the earlier documentary by focusing on the run-up to the project, reframing the archive footage and giving the viewer a fly-on-the-wall peep into the scenes in the recording studio. The singers themselves admit their own anxieties, from the trembling knees of Huey Lewis, Cyndi Lauper concerned about her jewellery leaking into the microphone and Bruce Springsteen and Bob Dylan both nervous about their solos.

A still from The Greatest Night in Pop by Bao Nguyen, an official selection of the Episodic Program at the 2024 Sundance Film Festival in Utah, US on January 19, 2024. PHOTO | POOL

Lionel Richie who cannot conceal his emotions through most scenes in the film provides the crucial link to the events surrounding the making of the song. “He is one of the most impressive, humble, hardworking stars I have come across,” says Julia Nottingham.

“From an editorial perspective, he is diligent, he’s thorough. He’s just amazing. He challenged us in the best ways and always wanted the best for it. He brought his best self to every moment in it.”

Although some of the videotapes were in poor condition and others were lost, an unlikely source came to the rescue. Journalist David Breskin who wrote an article for Life magazine about the project had kept his Dictaphone recording from the moment he was assigned the story, a few weeks prior to the recording, including in the studio.

Some of that audio was painstakingly synced to footage that had lost its audio. “No one has ever heard Michael and Lionel write that song,” says Julia “In the world of making archive films, these are gifts that you pray for, and when they arrive, you just thank your lucky star.”

Also read: US- based Kenyan creator makes waves with his footwear and music

We are the World was officially released on March 7 1985, and in another milestone, over 8,000 radio stations around the world played the song simultaneously on April 5, 1995. The record sold more than 20 million copies and won three Grammy Awards in 1986, including Song of the Year and Record of the Year, and raised more than $60 million for charity.

“Considering the chaos that happened, considering the confusion that was there, on top of the egos, we are doing the video, we are doing the vocals, we are doing the background singers, we are doing the still shots for the cover of Life magazine, in 7 hours?” Quipped Lionel Richie during the premiere of The Greatest Night In Pop at the Sundance Film Festival last weekend. “It is impossible! It worked.”

→ [email protected]","['night', 'song', 'gives', 'recording', 'peep', 'richie', 'iconic', '2024', 'sundance', '1985', 'film', 'documentary', 'music', 'world']"
Are some local banks over-risking in the Eurodollar market?,economy,"Columnists Are some local banks over-risking in the Eurodollar market?

The magnitude of their exposure to dollar-denominated instruments is a real concern in the current environment. PHOTO | SHUTTERSTOCK

By RUFUS MWANYASI

More by this Author

On Tuesday, the Central Bank of Kenya (CBK) quoted the shilling at 161.35 against the US dollar, a sharp drop from the 156.46 exchange rate at the end of December last year.

While some of the factors (both external and internal) behind this depreciation are well known, one gets a bad rap: the Eurodollar market - a misleading term referring to US dollars deposited in banks outside the United States and which are not subject to US banking regulations.

Are (some) players stockpiling dollars in anticipation that the local unit would lose further ground against the greenback and other major world currencies? I believe so.

The latest data from the Central Bank of Kenya (CBK) shows foreign currency deposits increasing at a faster pace than before. Total deposits reached Sh1.2 trillion at the end of June 2023, up 32 percent from Sh 891.5 billion as of June 2022.

Specifically, corporate bodies accumulated slightly over Sh800 billion in absolute foreign currency deposits by mid-last year compared to Sh592 Billion in the year prior. Similarly, household foreign currency deposits climbed by 26 percent to stand at Sh373 billion as at the end of June 2023 compared to a year prior.

Now, we can assume that, since corporations account for about 70 percent of the dollar deposits, these holdings are purely for international trade reasons. While that may be true, it's highly probable some players see the market as a window to long the dollar as a way to hedge against the fast-depreciating shilling.

Furthermore, with Eurodollar deposits offering attractive rates over domestic deposit rates, the trade is a no-brainer - fueling this rate premium is the fact that the Eurodollar market operates with minimal regulatory constraints, which in theory, should allow for higher deposit rates.

That said, concerns are being raised over the expanding short-term forex maturities within the banking system. Rising Eurodollars deposits, sourced as term deposits maturing at near terms (weeks to several months), although deemed low risk, pose a huge risk with the key question being: in a prolonged dollar-shortage scenario, where will banks get dollars to fill the dollar-funding gap?

Typically, these gaps should be funded by interbank forex loans, borrowing from central banks, currency swaps, etc. However, all these markets are in a tight bind because of risk and liquidity concerns. So, in a doomsday scenario, if a particularly important bank or series of banks in the Eurodollar market were to default, this could trigger damaging bank runs.

Even if a bank is sufficiently capitalised, large Eurodollar obligations are likely to undermine liquidity. Given these risks, the rapid growth of the Eurodollar market should not go unnoticed.

Although it provides an alternate channel of financing for banks to load up their balance sheets with Eurodollar liabilities, the potentially dire consequences with respect to dollar funding gaps is a major concern and needs to be monitored.

The magnitude of their exposure to dollar-denominated instruments is a real concern in the current environment.

Mwanyasi is MD, Canaan Capital","['foreign', 'overrisking', 'currency', 'local', 'risk', 'market', 'dollar', 'eurodollar', 'deposits', 'billion', 'bank', 'banks']"
